2018-01-23T17:49:43,The democrats told Ronald Reagan if gave 3 million illegal immigrants citizenship they would do immigration reform and border security.they LIED.democrats will never do border security,245.85,"['245.85', '247.25', '244.00', '250.50', '257.90']"
2018-01-23T17:46:19,The Republicans should break their promise about the dreamers.just like the democrats did to Reagan in the 80s.,245.85,"['245.85', '247.25', '244.00', '250.50', '257.90']"
2018-01-23T17:45:24,Welp my screen cracked WITH tempered glass protector on it... so thats how my day is going,245.85,"['245.85', '247.25', '244.00', '250.50', '257.90']"
2018-01-23T17:20:01,"""Michael Willams Goes to Space"" by member Patti Petrone Miller ",245.85,"['245.85', '247.25', '244.00', '250.50', '257.90']"
2018-01-23T17:12:07,I swear half the people in my class are a totally different breed..and not in a good way ,245.85,"['245.85', '247.25', '244.00', '250.50', '257.90']"
2018-01-23T16:00:22,my sinuses hurt so bad ,245.85,"['245.85', '247.25', '244.00', '250.50', '257.90']"
2018-01-23T14:52:57,Best Discount Quadcopter Battle Drone - Smartphone Remote Control Flying with Multiplayer Fighting Mode  Petrone... ,245.85,"['245.85', '247.25', '244.00', '250.50', '257.90']"
2018-01-23T13:35:57,The store's director Andrew Petrone  48  is workings on patterned marriage disposition representing a crude copulate  centre of a sum of fivesome or cardinal purchaser representing the daze unique marriage proposal ideas. His park  yet  is engaged with or...,245.85,"['245.85', '247.25', '244.00', '250.50', '257.90']"
2018-01-23T13:17:32,Bacardi Buys Petrone wow,245.85,"['245.85', '247.25', '244.00', '250.50', '257.90']"
2018-01-23T10:28:27,PETRONET LNG# BUY. Can be bought for short term gains  but I dont see much upside now  thou stock has is above its support zone. pic.twitter.com/VD5G7bZyjq,245.85,"['245.85', '247.25', '244.00', '250.50', '257.90']"
2018-01-23T10:07:13,I need at least a week to fathom the beauty of #TheGreatestShowman before watching it again in cinemas  @Zendaya @ZacEfron @RealHughJackman #MichaelGracey #CantDeal ,245.85,"['245.85', '247.25', '244.00', '250.50', '257.90']"
2018-01-23T09:57:10,Petronet LNG#39;s board meeting on January 31  2018 ,245.85,"['245.85', '247.25', '244.00', '250.50', '257.90']"
2018-01-23T09:25:10,PETRONET Fut Expiry of  28Mar2018 OI has decreased by -20%  ,245.85,"['245.85', '247.25', '244.00', '250.50', '257.90']"
2018-01-23T09:05:20,Oil&Gas Shares #Buzzing in trade. ONGC  Petronet LNG up over 3% in trade. pic.twitter.com/1rfEBzyNs9,245.85,"['245.85', '247.25', '244.00', '250.50', '257.90']"
2018-01-23T08:57:54,I -DAY PREMIUM CASH:#BUY NSE:#PETRONET ABOVE 243 TARGET 246-251 SL 238 OUR #FIRST #TGT 246 ALMOST ACHIEVED IN NSE:PETRONET BUY CALL BOOK PARTIAL PROFIT AND TRAIL SL AT COST CMP 245.5 For more information ✆ +91 9111-179961 or Visit ,245.85,"['245.85', '247.25', '244.00', '250.50', '257.90']"
2018-01-23T06:49:29,Petronet now 246. Booked around 24k. and closed.  ,245.85,"['245.85', '247.25', '244.00', '250.50', '257.90']"
2018-01-23T06:18:54,Mitch objected to paying military families. RIP to your argument.,245.85,"['245.85', '247.25', '244.00', '250.50', '257.90']"
2018-01-23T05:26:01,Aaaannnddd nah,245.85,"['245.85', '247.25', '244.00', '250.50', '257.90']"
2018-01-23T05:22:51,Aaaaaand Love is goin to NOLA,245.85,"['245.85', '247.25', '244.00', '250.50', '257.90']"
2018-01-23T05:09:43,@BarstoolBigCat  Throwback,245.85,"['245.85', '247.25', '244.00', '250.50', '257.90']"
2018-01-23T05:06:55,currently taking a fat shit on you in Vegas and AE  petrone make me cines fatty,245.85,"['245.85', '247.25', '244.00', '250.50', '257.90']"
2018-01-23T04:59:16,petrone making me wanna go back to my tamako avi,245.85,"['245.85', '247.25', '244.00', '250.50', '257.90']"
2018-01-23T04:31:07,Under,245.85,"['245.85', '247.25', '244.00', '250.50', '257.90']"
2018-01-23T04:30:19,Just look at the Ref Huddle of the Saints-Vikings game.,245.85,"['245.85', '247.25', '244.00', '250.50', '257.90']"
2018-01-23T04:14:07,#Petronet LNG looks good to me. Target of 255 and 275 with stop of 230. CMP 243.10 Feb FUT 243.05 pic.twitter.com/KgbB8yBe9h,245.85,"['245.85', '247.25', '244.00', '250.50', '257.90']"
2018-01-23T03:38:18,Well in that case I’ll have two up ,245.85,"['245.85', '247.25', '244.00', '250.50', '257.90']"
2018-01-23T03:28:45,Its next week not this weekend  so i expect one this weekend ,245.85,"['245.85', '247.25', '244.00', '250.50', '257.90']"
2018-01-23T03:04:08,I didn’t record this past week. I’ll have another one up either Saturday or Monday. Since Sunday is the super bowl lol,245.85,"['245.85', '247.25', '244.00', '250.50', '257.90']"
2018-01-23T03:00:59,KOTAK ON PETRONET LNG TGT 290 Time to BUY We upgrade PLNG to BUY from ADD as recent sharp under-performance  has made the valuations compelling TRIGGERS (1) completion of pipeline to Mangalore  (2) Dahej expansion and (3) contractual escalation in tariffs.,245.85,"['245.85', '247.25', '244.00', '250.50', '257.90']"
2018-01-23T02:58:14,Wheres ur new one?!,245.85,"['245.85', '247.25', '244.00', '250.50', '257.90']"
2018-01-23T02:38:56,soar petrone lets go baby,245.85,"['245.85', '247.25', '244.00', '250.50', '257.90']"
2018-01-23T01:53:04,"Weird how Schumer ended the ""Trump shutdown""  ain't it? #SchumerSellout",245.85,"['245.85', '247.25', '244.00', '250.50', '257.90']"
2018-01-23T01:48:48,Plz tell me you’ll be home,245.85,"['245.85', '247.25', '244.00', '250.50', '257.90']"
2018-01-23T01:21:21,3 more days til Florida  3.more.days,245.85,"['245.85', '247.25', '244.00', '250.50', '257.90']"
2018-01-23T00:27:10,Extremely disappointing to see @JesseArreguin's kneejerk reaction against a bill aimed at making housing more affordable & enviro-friendly by increasing housing along transit corridors. I live w/ in one of the impacted zones and support this bill.,245.85,"['245.85', '247.25', '244.00', '250.50', '257.90']"
2018-01-24T23:33:31,Can’t wait until May of 2019 when I become a nurse and don’t have to work two jobs anymore and making great money and most importantly not be in nursing school ever again,247.25,"['247.25', '244.00', '250.50', '257.90', '254.75']"
2018-01-24T23:08:05,Thoughts and prayers to Black twitter over the lose of Erykah Badu....,247.25,"['247.25', '244.00', '250.50', '257.90', '254.75']"
2018-01-24T21:17:21,1 daily unfollower. Crowdfire doesn't miss a trick - via,247.25,"['247.25', '244.00', '250.50', '257.90', '254.75']"
2018-01-24T19:22:16,Ah listo. Ok.,247.25,"['247.25', '244.00', '250.50', '257.90', '254.75']"
2018-01-24T19:19:49,$PFWI Stock Live Analysis 01-24-2018 Petrone Worldwide Inc. #PFWI,247.25,"['247.25', '244.00', '250.50', '257.90', '254.75']"
2018-01-24T19:14:51,When people tell you that you look tired   they actually low key mean you look like shit ,247.25,"['247.25', '244.00', '250.50', '257.90', '254.75']"
2018-01-24T19:07:06,where can I stream Cold Case,247.25,"['247.25', '244.00', '250.50', '257.90', '254.75']"
2018-01-24T18:42:06,Grab the Petrone its going to be a long night Khalid - Winter ,247.25,"['247.25', '244.00', '250.50', '257.90', '254.75']"
2018-01-24T17:41:27,Petrone Tech coming soon too: ,247.25,"['247.25', '244.00', '250.50', '257.90', '254.75']"
2018-01-24T15:47:49,Kochi Aims to Eradicate Hunger in the City.  The initiative has been envisioned in collaboration with Petronet LNG Foundation and Kerala Hotel and Restaurant Association Ernakulam District Committee and is expected to start its operations on February 1. ,247.25,"['247.25', '244.00', '250.50', '257.90', '254.75']"
2018-01-24T15:40:07,We’re nuts,247.25,"['247.25', '244.00', '250.50', '257.90', '254.75']"
2018-01-24T15:17:42,Kaushal Setu  Petronet LNG Foundation Skill Training initiative with CIPET. Admission interview schedule on 24th Jan. at CIPET Ahmedabad. pic.twitter.com/vLikNtJeLg,247.25,"['247.25', '244.00', '250.50', '257.90', '254.75']"
2018-01-24T14:56:40,Hunger free City .... An initiative supported by Petronet LNG Foundation pic.twitter.com/VzOw8M7W9x,247.25,"['247.25', '244.00', '250.50', '257.90', '254.75']"
2018-01-24T13:03:59,@WUZ1045 do you think we saw a preview of the Stanley cup final last night with the Lightning & Preds???,247.25,"['247.25', '244.00', '250.50', '257.90', '254.75']"
2018-01-24T12:34:48,Thanks to the Girl and Boy Scouts of Cortlandt Manor for the hand made Thank You notes after their recent visit to the WHUD studios! Our future leaders with Mike & Kacey and program director Steve Petrone! pic.twitter.com/0awUPzbKIT,247.25,"['247.25', '244.00', '250.50', '257.90', '254.75']"
2018-01-24T08:35:18,Vijay Chopra of ,247.25,"['247.25', '244.00', '250.50', '257.90', '254.75']"
2018-01-24T07:33:07,Petronet LNG Ltd to approve Q3 results on Jan 31  2018 ,247.25,"['247.25', '244.00', '250.50', '257.90', '254.75']"
2018-01-24T07:31:15,Petronet LNG Steady ,247.25,"['247.25', '244.00', '250.50', '257.90', '254.75']"
2018-01-24T07:00:02,#PETRONET - Petronet is in Short list - ,247.25,"['247.25', '244.00', '250.50', '257.90', '254.75']"
2018-01-24T06:52:23,Buy petronet 245 PE january Cmp 1 rs. Sl 0.5 rs. Target 2-3 Lot size 3000 shares,247.25,"['247.25', '244.00', '250.50', '257.90', '254.75']"
2018-01-24T06:45:36,Petronet LNG  following the lines. #short #stockspic.twitter.com/MiJOUwKExO,247.25,"['247.25', '244.00', '250.50', '257.90', '254.75']"
2018-01-24T06:44:58,Petronet is in Short list $PETRONET ,247.25,"['247.25', '244.00', '250.50', '257.90', '254.75']"
2018-01-24T06:35:53,Petronet LNG going through pressure expecting 247 support at 246 #Nifty #INTRADAY,247.25,"['247.25', '244.00', '250.50', '257.90', '254.75']"
2018-01-24T05:18:40,Alert: Buy (1) PETRONET on 1/24/2018 9:00:00 AM Buy in Hourly chart Entry@ PETRONET250.25 T1-@268.75 T2-@287.25 T3-@324.25 &SL-@231.75,247.25,"['247.25', '244.00', '250.50', '257.90', '254.75']"
2018-01-24T04:18:42,Nomura upgrades Petronet to Buy. Says Gail top pick in Oil and Gas space GAIL > IGL > PLNG > GUJS pic.twitter.com/l2G9h10vfH,247.25,"['247.25', '244.00', '250.50', '257.90', '254.75']"
2018-01-24T04:14:13,# Nifty BUY PETRONET@CMp-250 TGT-256-259 SL-244#stocks94,247.25,"['247.25', '244.00', '250.50', '257.90', '254.75']"
2018-01-24T03:49:22,SPACE(INTRADAY) SELL   PETRONET Price: 248.2   SL: 252.9,247.25,"['247.25', '244.00', '250.50', '257.90', '254.75']"
2018-01-24T03:45:31,With 10k pure sales a week? okay,247.25,"['247.25', '244.00', '250.50', '257.90', '254.75']"
2018-01-24T03:42:04,Until you realize the people walking their dogs in the neighborhood can see everything you do in evey room of the house.,247.25,"['247.25', '244.00', '250.50', '257.90', '254.75']"
2018-01-24T03:21:58,Taylor ruling it all,247.25,"['247.25', '244.00', '250.50', '257.90', '254.75']"
2018-01-24T03:05:35,Bull’s Eye: Buy SBI  PNB  Petronet  Havells  Reliance Infra  Mindtree  BoB ,247.25,"['247.25', '244.00', '250.50', '257.90', '254.75']"
2018-01-24T03:03:01,Bull#39;s Eye: Buy SBI  PNB  Petronet  Havells  Reliance Infra  Mindtree  BoB ,247.25,"['247.25', '244.00', '250.50', '257.90', '254.75']"
2018-01-24T03:02:59,Bull#39;s Eye: Buy SBI  PNB  Petronet  Havells  Reliance Infra  Mindtree  BoB ,247.25,"['247.25', '244.00', '250.50', '257.90', '254.75']"
2018-01-24T03:00:29,Bull#39;s Eye: Buy SBI  PNB  Petronet  Havells  Reliance Infra  Mindtree  BoB:  Vijay Chopra of enochventu ,247.25,"['247.25', '244.00', '250.50', '257.90', '254.75']"
2018-01-24T02:07:40,Nomura upgrade Petronet LNG  back to buy from UW: With recent stk price correction  it’s a good opportunity to Buy again as valns @ 15X/ 13X FY19/20 PER looks reasonable. We maintain our ests & TP of Rs 300),247.25,"['247.25', '244.00', '250.50', '257.90', '254.75']"
2018-01-24T02:05:36,petrone will take any waifu and just ruin it,247.25,"['247.25', '244.00', '250.50', '257.90', '254.75']"
2018-01-24T01:56:18,My sisters have been back at school for almost two days and I  miss them terribly ,247.25,"['247.25', '244.00', '250.50', '257.90', '254.75']"
2018-01-24T01:19:07,I love you sm,247.25,"['247.25', '244.00', '250.50', '257.90', '254.75']"
2018-03-01T21:37:58,nigga i said i’m afraid petrone might shoot up the school,240.80,"['240.80', '235.50', '233.95', '235.40', '235.40']"
2018-03-01T21:18:07,#QriketLIVE #jcomparel Happy Birthday Mark from Barbara Petrone and Dawn Roberts !! We love you pic.twitter.com/W5C6YQ5K8z,240.80,"['240.80', '235.50', '233.95', '235.40', '235.40']"
2018-03-01T20:44:36,I really hate all social media people take it waaay too seriously its scary ,240.80,"['240.80', '235.50', '233.95', '235.40', '235.40']"
2018-03-01T20:30:07,Please check out Author KG Petrone's website and blog!  Follow her here at @kgpetrone  Support your fellow artists!  Immense time and energy go into creating a website - let's make it worth it for all of us.  <3  ,240.80,"['240.80', '235.50', '233.95', '235.40', '235.40']"
2018-03-01T20:21:14,Dani Alves  Hummels y Neymar,240.80,"['240.80', '235.50', '233.95', '235.40', '235.40']"
2018-03-01T19:56:00,i hate the fact i go to school with petrone i feel like he actually might end up shooting it up one day,240.80,"['240.80', '235.50', '233.95', '235.40', '235.40']"
2018-03-01T17:40:59,@jaebrenemedia where is Part 2?,240.80,"['240.80', '235.50', '233.95', '235.40', '235.40']"
2018-03-01T17:27:28,Idem tmb.,240.80,"['240.80', '235.50', '233.95', '235.40', '235.40']"
2018-03-01T17:18:49,Hear Ted Petrone @NaviosGroup $NNA speak on #CrudeOilTanker panel at #CL_NYShipping! REGISTER NOW: ,240.80,"['240.80', '235.50', '233.95', '235.40', '235.40']"
2018-03-01T13:48:58, only comeback to 5 rings is Felony sexual assualt. Smh.,240.80,"['240.80', '235.50', '233.95', '235.40', '235.40']"
2018-03-01T13:48:04,Damn  you winpic.twitter.com/CF0zkqCYGy,240.80,"['240.80', '235.50', '233.95', '235.40', '235.40']"
2018-03-01T13:45:54,Kobe has the same moral values as Cosby. #Rapistpic.twitter.com/lNoA5rAcN5,240.80,"['240.80', '235.50', '233.95', '235.40', '235.40']"
2018-03-01T13:35:07,Lebron softer than Charmin,240.80,"['240.80', '235.50', '233.95', '235.40', '235.40']"
2018-03-01T13:02:34,Check out this book - 'The Menacing House' by K.G. Petrone ,240.80,"['240.80', '235.50', '233.95', '235.40', '235.40']"
2018-03-01T12:47:56,See those awesome outlet passes Kevin Love throws for 1-on-0 and 2-on-1 fast break layups? Don’t happen with guys crashing so hard. All give and take  I see both sides  get frustrated myself with Ben Simmons doing the same thing vs running the floor.,240.80,"['240.80', '235.50', '233.95', '235.40', '235.40']"
2018-03-01T07:56:18,Buy Petronet 240 PE march series @ 4 SL 2 Tgt 12/15 #Nifty,240.80,"['240.80', '235.50', '233.95', '235.40', '235.40']"
2018-03-01T06:54:46,@boogiecousins  Imagine,240.80,"['240.80', '235.50', '233.95', '235.40', '235.40']"
2018-03-01T06:53:08,So Bron is a better person than Kobe.,240.80,"['240.80', '235.50', '233.95', '235.40', '235.40']"
2018-03-01T06:43:58,Whos losin to the FailClowns? Last I checked they were 3rd in the division.,240.80,"['240.80', '235.50', '233.95', '235.40', '235.40']"
2018-03-01T05:53:01,Buy petronet @242.5 sl 235 target 260-265,240.80,"['240.80', '235.50', '233.95', '235.40', '235.40']"
2018-03-01T05:40:29,Buy Gujarat State Petronet  target Rs 221: Pritesh Mehta,240.80,"['240.80', '235.50', '233.95', '235.40', '235.40']"
2018-03-01T05:34:38,Buy Gujarat State Petronet  target Rs 221: Pritesh Mehta,240.80,"['240.80', '235.50', '233.95', '235.40', '235.40']"
2018-03-01T05:02:42,Buy Gujarat State Petronet  target Rs 221: Pritesh Mehta ,240.80,"['240.80', '235.50', '233.95', '235.40', '235.40']"
2018-03-01T04:38:45,Bullish- Voltas  MGL. Bearish- Petronet  Piramal Enterprises  Apollo Tyres  ICICI Bank. Standard disclaimer- These are not trade recommendations. May or may not have positions in them.,240.80,"['240.80', '235.50', '233.95', '235.40', '235.40']"
2018-03-01T04:24:43,Yeah everyone acts like we don’t do that on purpose and thatbit doesn’t help facilitate our offense.,240.80,"['240.80', '235.50', '233.95', '235.40', '235.40']"
2018-03-01T04:05:09,Not sure. I think there's one down in red Bank,240.80,"['240.80', '235.50', '233.95', '235.40', '235.40']"
2018-03-01T03:56:08,#GSPL: Gujarat State Petronet Ltd has lost a star  now a 4 star stock. (,240.80,"['240.80', '235.50', '233.95', '235.40', '235.40']"
2018-03-01T03:53:05,what do you have against my boy expecto petrone,240.80,"['240.80', '235.50', '233.95', '235.40', '235.40']"
2018-03-01T03:45:20,Worth it but not for my teams cap,240.80,"['240.80', '235.50', '233.95', '235.40', '235.40']"
2018-03-01T03:28:04,He doesn't want to lose to the falcons twice a year though,240.80,"['240.80', '235.50', '233.95', '235.40', '235.40']"
2018-03-01T03:22:28,expecto synergy petrone,240.80,"['240.80', '235.50', '233.95', '235.40', '235.40']"
2018-03-01T03:17:46,everyone has these on now uh i could make u guys some new ones stop copying me and petrone nerDs,240.80,"['240.80', '235.50', '233.95', '235.40', '235.40']"
2018-03-01T02:40:02,Id rather have the player than the cash.,240.80,"['240.80', '235.50', '233.95', '235.40', '235.40']"
2018-03-01T02:37:26,petrone is precious,240.80,"['240.80', '235.50', '233.95', '235.40', '235.40']"
2018-03-01T02:37:20,I can seee you fittin in cleann right in the middle.pic.twitter.com/betmLWL7Df,240.80,"['240.80', '235.50', '233.95', '235.40', '235.40']"
2018-03-01T00:41:37,why is today 4 days long,240.80,"['240.80', '235.50', '233.95', '235.40', '235.40']"
2018-03-01T00:41:25,I b sipping on Petrone and wine I’m just trying to have a good fucking time,240.80,"['240.80', '235.50', '233.95', '235.40', '235.40']"
2018-03-25T23:31:56,I liked a @YouTube video ,225.90,"['225.90', '226.75', '230.95', '230.85', '232.00']"
2018-03-25T23:16:46,Referees: Hold our beer,225.90,"['225.90', '226.75', '230.95', '230.85', '232.00']"
2018-03-25T23:14:24,This is easily the best game of the torny in terms of skill,225.90,"['225.90', '226.75', '230.95', '230.85', '232.00']"
2018-03-25T23:03:00,Petrone Worldwide Inc. $PFWI Stock Live Analysis 11-20-2017 #tradeideas,225.90,"['225.90', '226.75', '230.95', '230.85', '232.00']"
2018-03-25T22:25:39,"""I don’t want to use the word leader. I think if everybody’s on the same page  we are the leader.""  » Joe-Joe Petrone  Director of Sports Medicine #WarEagle",225.90,"['225.90', '226.75', '230.95', '230.85', '232.00']"
2018-03-25T22:16:16,The jets back out of the race to get Suh so there goes the major money!!!,225.90,"['225.90', '226.75', '230.95', '230.85', '232.00']"
2018-03-25T22:14:10,Rams are trying to win it all Next Year that sums everything up,225.90,"['225.90', '226.75', '230.95', '230.85', '232.00']"
2018-03-25T22:13:28,Not a discount he will make more but his contract won’t expire tell after 2020 season so not too worried about it now.,225.90,"['225.90', '226.75', '230.95', '230.85', '232.00']"
2018-03-25T22:11:09,Youre asking a kid to take a discount on his first reup? Cmon. Hes gonna secure the bag.,225.90,"['225.90', '226.75', '230.95', '230.85', '232.00']"
2018-03-25T22:04:11,I liked a @YouTube video ,225.90,"['225.90', '226.75', '230.95', '230.85', '232.00']"
2018-03-25T22:03:41,Peters no but we have this year and next year with him by then I’m guessing Talib will be gone so replace his contract with peters plus there’s always the franchise tag for insurance. The Rams have a lot of players on rookie contracts and they got rid of a lot of bad contracts.,225.90,"['225.90', '226.75', '230.95', '230.85', '232.00']"
2018-03-25T22:00:58,Do you think Marcus Peters will take a discount? ,225.90,"['225.90', '226.75', '230.95', '230.85', '232.00']"
2018-03-25T21:47:14,You guys assume Goff will take a huge deal imagine if he does a Brady type deal that’s cap friendly I think winning is more important to him than money! But only time will tell right.,225.90,"['225.90', '226.75', '230.95', '230.85', '232.00']"
2018-03-25T21:36:50,Cmon dawg. Numbers are numbers. That team will implode come FA.,225.90,"['225.90', '226.75', '230.95', '230.85', '232.00']"
2018-03-25T21:30:11,Mike Petrone Piano at Brother's Lounge #117thDetroit  March 25  2018 at 05:30PM: ,225.90,"['225.90', '226.75', '230.95', '230.85', '232.00']"
2018-03-25T20:44:43,congratulations Maria Petrone well deserved for all your hard work and dedication to Staten Island and the arts. ,225.90,"['225.90', '226.75', '230.95', '230.85', '232.00']"
2018-03-25T19:19:50,I liked a @YouTube video ,225.90,"['225.90', '226.75', '230.95', '230.85', '232.00']"
2018-03-25T17:35:05,I really do have the worst luck with cars and it’s SO ANNOYING,225.90,"['225.90', '226.75', '230.95', '230.85', '232.00']"
2018-03-25T16:49:31,Best Discount Quadcopter Battle Drone - Smartphone Remote Control Flying with Multiplayer Fighting Mode  Petrone... ,225.90,"['225.90', '226.75', '230.95', '230.85', '232.00']"
2018-03-25T13:21:43,Its still technically a 1 possession game...,225.90,"['225.90', '226.75', '230.95', '230.85', '232.00']"
2018-03-25T11:01:27,Oh shit! I've been had,225.90,"['225.90', '226.75', '230.95', '230.85', '232.00']"
2018-03-25T10:31:48,"Talking about huts and goats  how did apartheid South Africa build Sasol  Eskom  Iscor  Denel  build Petronet etc. while in isolation. Where was the ""foreign direct investor""?",225.90,"['225.90', '226.75', '230.95', '230.85', '232.00']"
2018-03-25T10:06:32,You clicked the bait....lol,225.90,"['225.90', '226.75', '230.95', '230.85', '232.00']"
2018-03-25T09:13:27,It doesn't matter if he's a 100% shooter you're still down by 6 with 10 seconds left !  You hit a three and make someone else get the ball on inbounds pass and pray he misses both.  Then you have a heave for the tie.  Don't give me this bullshit you don't foul.  Don't give up !!!,225.90,"['225.90', '226.75', '230.95', '230.85', '232.00']"
2018-03-25T08:38:39,"""Clickbait""? Explain yourself  moron. Have you never seen a comeback win in that EXACT situation? I've seen it several fucking times. It's worked in pros & they get two free not one-and-one. Look up Reggie Miller. You're stupid or ignorant or both. Or wait maybe it's because ...pic.twitter.com/IIoxGixHcs",225.90,"['225.90', '226.75', '230.95', '230.85', '232.00']"
2018-03-25T07:42:01,Point shaving happens,225.90,"['225.90', '226.75', '230.95', '230.85', '232.00']"
2018-03-25T07:35:05,How is it clickbait? The purpose of creating the content is for people to read it.,225.90,"['225.90', '226.75', '230.95', '230.85', '232.00']"
2018-03-25T07:08:32,one person followed me // automatically checked by,225.90,"['225.90', '226.75', '230.95', '230.85', '232.00']"
2018-03-25T06:21:15,90% free throw shooter...10 seconds left....no time outs...still down 4 if the 90% free throw shooter misses both...is what your wife should have responded to save you from this stupid tweet,225.90,"['225.90', '226.75', '230.95', '230.85', '232.00']"
2018-03-25T06:19:24,Another stupid comment...they played the game they lost they didn’t give up anything..the game was over...go home,225.90,"['225.90', '226.75', '230.95', '230.85', '232.00']"
2018-03-25T06:17:39,Clickbait,225.90,"['225.90', '226.75', '230.95', '230.85', '232.00']"
2018-03-25T06:17:26,And also FSU had no time outs down 4 soon to be 6 with 10 seconds left...my question is why didn’t fsu run the 6 point shot play,225.90,"['225.90', '226.75', '230.95', '230.85', '232.00']"
2018-03-25T05:51:27,He said the game was over...he was correct,225.90,"['225.90', '226.75', '230.95', '230.85', '232.00']"
2018-03-25T04:16:35,Gally  Nation Throwback  Elder p Delany C  Petrone SS  Wheel House Daylight pickoff at 11yrs old pic.twitter.com/Tg46lrzWio,225.90,"['225.90', '226.75', '230.95', '230.85', '232.00']"
2018-03-25T03:22:28,Basically ready for my spot on the Great British Baking Show now.pic.twitter.com/u3JRPXqRJn,225.90,"['225.90', '226.75', '230.95', '230.85', '232.00']"
2018-03-25T01:43:57,He was a Christian terrorist. Plain and simple.,225.90,"['225.90', '226.75', '230.95', '230.85', '232.00']"
2018-03-25T01:42:22,Large volumes (week of 23 March) ASHOKA BUILDCON LTD GHCL LTD Cox & Kings Limited Sobha Limited GUJARAT STATE PETRONET LTD JBF INDUSTRIES LTD HIKAL LTD CUMMINS INDIA LTD ZEE ENTERTAINMENT ENTERPRISES LTD PRISM CEMENT LTD #bse #NSE,225.90,"['225.90', '226.75', '230.95', '230.85', '232.00']"
2018-03-19T23:53:58,Cod 4: Gorb/Kenny (even thought he quit forever ago) WaW: Scrafty MW2: Flavors BO1: Dumbohs MW3: Petrone BO2: Airhis or Burst Ghosts: Rodri or Keyzo AW: Jazmo/Jaylt BO3: Dxezy  WW2: Weddy,233.65,"['233.65', '235.65', '235.50', '234.15', '232.00']"
2018-03-19T23:18:55,The Uber car was deff female ,233.65,"['233.65', '235.65', '235.50', '234.15', '232.00']"
2018-03-19T21:57:11,"PETRONE LEMON LIQUEUR ""LIMONCELLO"" 70cl AND TWO CERAMIC CUPS FROM VIETRI ",233.65,"['233.65', '235.65', '235.50', '234.15', '232.00']"
2018-03-19T21:42:12,It really is ,233.65,"['233.65', '235.65', '235.50', '234.15', '232.00']"
2018-03-19T21:01:17,I mix Petrone with the Henny!,233.65,"['233.65', '235.65', '235.50', '234.15', '232.00']"
2018-03-19T19:08:45,Excited to launch our partnership with Efma! Contributing together to #FinTech innovation at SCALE! @Efma_news @nicolo_petrone @SeemaAlexander @amitTwitr,233.65,"['233.65', '235.65', '235.50', '234.15', '232.00']"
2018-03-19T19:04:37,Favorite Trickshotters: COD 4: Gorb WAW: percent MW2: Differ BO1: Paste and Dumbohs MW3: Petrone BO2: Caspr  Ghosts: Jays AW: Axl  BO3: Kara (when he played) IW: Mice WW2: Nambu or Kenshi,233.65,"['233.65', '235.65', '235.50', '234.15', '232.00']"
2018-03-19T18:53:24,Get used to it  ive been in competition with steve and his trucks since i met him,233.65,"['233.65', '235.65', '235.50', '234.15', '232.00']"
