2018-01-19T01:42:11,In desperate need of a wine night with my friends ,237.05,"['237.05', '237.80', '245.85', '247.25', '244.00']"
2018-01-19T01:40:47,Lmao I had no idea ,237.05,"['237.05', '237.80', '245.85', '247.25', '244.00']"
2018-01-19T01:40:25,MY GIRL THERES A GIF BUTTON UNDER EVERY TWEETpic.twitter.com/63WYVjJnsi,237.05,"['237.05', '237.80', '245.85', '247.25', '244.00']"
2018-01-19T01:37:36, how did you do that??,237.05,"['237.05', '237.80', '245.85', '247.25', '244.00']"
2018-01-19T01:29:09,petrone got so mad that i canceled my live he bought gold for my account just to use it as a 2box,237.05,"['237.05', '237.80', '245.85', '247.25', '244.00']"
2018-01-19T00:59:32,Excuse me but what actually is a GIF?? Sry ppl I need to walk into the 21st century  I know,237.05,"['237.05', '237.80', '245.85', '247.25', '244.00']"
2018-03-15T23:24:32,You know what though...I legit watched today and said to myself it’s a shame he can’t stay in school for 1 more year...but I nor anyone else would pass up being a lottery pick... But he’s gona suck in the pros he’s more Jimmer then steph,237.40,"['237.40', '235.00', '233.65', '235.65', '235.50']"
2018-03-15T21:21:55,THIS. <3 Thank you  Liz Petrone  for your utterly gorgeous gift of words. ,237.40,"['237.40', '235.00', '233.65', '235.65', '235.50']"
2018-03-15T21:14:34,it was petrone,237.40,"['237.40', '235.00', '233.65', '235.65', '235.50']"
2018-03-15T21:10:27,New #SOTG partner! 1Side Performance founder Coach Matt Petrone. ,237.40,"['237.40', '235.00', '233.65', '235.65', '235.50']"
2018-03-15T20:27:09,Yaaaassssss bitchhh,237.40,"['237.40', '235.00', '233.65', '235.65', '235.50']"
2018-03-15T18:50:00,#PETRONET - #PETRONET CASH : BULLISH ABOVE 240 - ,237.40,"['237.40', '235.00', '233.65', '235.65', '235.50']"
2018-03-15T18:04:44,Oh a peace sign is a nazi symbol?,237.40,"['237.40', '235.00', '233.65', '235.65', '235.50']"
2018-03-15T17:54:14,#PETRONET CASH : BULLISH ABOVE 240 - $PETRONET chart ,237.40,"['237.40', '235.00', '233.65', '235.65', '235.50']"
2018-03-15T17:52:27,#PETRONET CASH -POSITIONAL CALL (15 MARCH 2018) LOOKS GOOD ABOVE 240 STOPLOSS 235 TGT 244.50/248-50 CMP 237.50 pic.twitter.com/V7myNFnZfE,237.40,"['237.40', '235.00', '233.65', '235.65', '235.50']"
2018-03-15T17:00:48,*with dreads,237.40,"['237.40', '235.00', '233.65', '235.65', '235.50']"
2018-03-15T16:32:04,Haha usually usually...whatever team has the smallest fastest black guy in the torny is my pick to win,237.40,"['237.40', '235.00', '233.65', '235.65', '235.50']"
2018-03-15T16:26:13,How far do you have Murray state going. That's definitely your squad,237.40,"['237.40', '235.00', '233.65', '235.65', '235.50']"
2018-03-15T15:39:16,That's up to Mr. Petrone.,237.40,"['237.40', '235.00', '233.65', '235.65', '235.50']"
2018-03-15T15:29:21,Got on the turnpike heading to Harrisburg instead of Philly on my way home from school today bc Im so damn tired  I really am something else ,237.40,"['237.40', '235.00', '233.65', '235.65', '235.50']"
2018-03-15T15:26:48,AHHH I WANNA PLAY FORTNITE WITH PETRONE AND SEE HOW BAD HE IS,237.40,"['237.40', '235.00', '233.65', '235.65', '235.50']"
2018-03-15T15:17:15,The Bears stink. Keep hating.pic.twitter.com/Z3i8H39L4i,237.40,"['237.40', '235.00', '233.65', '235.65', '235.50']"
2018-03-15T15:15:32,You just listed their targets.,237.40,"['237.40', '235.00', '233.65', '235.65', '235.50']"
2018-03-15T14:51:40,@StillsStephen here's one for you.  since i am almost your age  it's hard to be serious about the words to 4&20.  so i change the beginning to 'many  many years ago...'.  you might want to try that,237.40,"['237.40', '235.00', '233.65', '235.65', '235.50']"
2018-03-15T14:24:00,@joerogan  is in the wrong business  get him a PS4 account.,237.40,"['237.40', '235.00', '233.65', '235.65', '235.50']"
2018-03-15T14:22:13,At first I had flashbacks of him being pretty bad. But people improve. I like the move.,237.40,"['237.40', '235.00', '233.65', '235.65', '235.50']"
2018-03-15T14:15:08,Cant wait to start this part time job,237.40,"['237.40', '235.00', '233.65', '235.65', '235.50']"
2018-03-15T13:39:27,Do you like the @PatRobinson25 free agent pickup?,237.40,"['237.40', '235.00', '233.65', '235.65', '235.50']"
2018-03-15T13:28:40,Happy Tournament day,237.40,"['237.40', '235.00', '233.65', '235.65', '235.50']"
2018-03-15T12:37:11,"#ShortStory #teasertuesday #amreading Enjoy your morning cup of joe reading this Suspense Mystery by KG Petrone for ONLY $0.99 @AmazngKindles @PromoteKindleBK ""Just looking at the house scared her to death. But what could she do? A dare was a dare."" ",237.40,"['237.40', '235.00', '233.65', '235.65', '235.50']"
2018-03-15T11:38:28,Girls Varsity Soccer Stats: Elana Petrone - 1 goal (Penalty Kick) #CHSoccer,237.40,"['237.40', '235.00', '233.65', '235.65', '235.50']"
2018-03-15T11:28:16,#Newrelease #anthology #poems #invisibleillness #grief #pain #depression #family #healingthruwords The Fractured Ego by KG Petrone ,237.40,"['237.40', '235.00', '233.65', '235.65', '235.50']"
2018-03-15T10:51:09,one person followed me // automatically checked by,237.40,"['237.40', '235.00', '233.65', '235.65', '235.50']"
2018-03-15T07:14:19,December 2017 Quarter - Highest decrease in stake • FPIs – Bharat Financial Inclusion  Indiabulls Real Estate and Indiabulls Housing • MFs – Castrol India  Indiabulls Real Estate and Petronet LNG • BFIs – Bank of Baroda  NALCO and GAIL,237.40,"['237.40', '235.00', '233.65', '235.65', '235.50']"
2018-03-15T04:53:24,Best Discount Quadcopter Battle Drone - Smartphone Remote Control Flying with Multiplayer Fighting Mode  Petrone... ,237.40,"['237.40', '235.00', '233.65', '235.65', '235.50']"
2018-03-15T04:11:06,Coleman won't be missed,237.40,"['237.40', '235.00', '233.65', '235.65', '235.50']"
2018-03-15T04:10:37,He been tender by the saints he be back with the saints,237.40,"['237.40', '235.00', '233.65', '235.65', '235.50']"
2018-03-15T03:58:40,Maaaaan. Harris.. smh. Never seen sombody single handedly lose more games for a team.,237.40,"['237.40', '235.00', '233.65', '235.65', '235.50']"
2018-03-15T03:56:50,Defense lead that niners team to the playoffs be real.  Luke is on the Cowboys  never been on the Jets. Only reason people dont know he is better than kaep is because he was stuck behind Brees for his prime.,237.40,"['237.40', '235.00', '233.65', '235.65', '235.50']"
2018-03-15T03:53:31,When Luke ever led his team to a playoff birth  neber he just a serviceable back up starting for jets,237.40,"['237.40', '235.00', '233.65', '235.65', '235.50']"
2018-03-15T03:45:25,Bet they cant trade shoes.,237.40,"['237.40', '235.00', '233.65', '235.65', '235.50']"
2018-03-15T03:40:20,Luke Mccown is  idk about Josh tho,237.40,"['237.40', '235.00', '233.65', '235.65', '235.50']"
2018-03-15T02:29:27,petrone watched the first 3 eps of evangelion and immediately put on a rei avi,237.40,"['237.40', '235.00', '233.65', '235.65', '235.50']"
2018-03-15T01:35:54,@PIC_Harry @PIC_Petrone @JonBrubaker it's that time of the year again,237.40,"['237.40', '235.00', '233.65', '235.65', '235.50']"
2018-03-15T01:31:11,Girls Soccer FINAL New Kent 3 Colonial Heights 1  lone goal for CH by Petrone  New Kent goals scored by Lysek  Liements  Brady #CVASports @ProgressIndex,237.40,"['237.40', '235.00', '233.65', '235.65', '235.50']"
2018-03-15T01:16:08,If not any other team I hope so cause I work with a browns guy.... yes he’s a nice guy just miserable,237.40,"['237.40', '235.00', '233.65', '235.65', '235.50']"
2018-03-15T00:41:32,Coventry Superintendent of Schools David Petrone: School officials need to strike a fine balance between having a “safe” school and a “fortress.” @thechroniclect,237.40,"['237.40', '235.00', '233.65', '235.65', '235.50']"
2018-03-15T00:25:04,Probably back with the Browns ,237.40,"['237.40', '235.00', '233.65', '235.65', '235.50']"
2018-03-15T00:12:15,But dear god do I love willie. Excited to see where he ends up,237.40,"['237.40', '235.00', '233.65', '235.65', '235.50']"
2018-03-15T00:10:22,That aspect is true.,237.40,"['237.40', '235.00', '233.65', '235.65', '235.50']"
2018-03-15T00:09:45,Gave them the opportunity by his dui. Deff his fault,237.40,"['237.40', '235.00', '233.65', '235.65', '235.50']"
2018-03-15T00:01:43,Im not sure Sneads bad season was all his fault  just had his role filled by Ginn and TommyLee.,237.40,"['237.40', '235.00', '233.65', '235.65', '235.50']"
2018-01-07T23:43:20,See ya Saturday Brady #TitanUp,254.70,"['254.70', '253.20', '251.00', '249.45', '252.50']"
2018-01-07T23:05:07,Forrrreallll it hurts to breathe dude ,254.70,"['254.70', '253.20', '251.00', '249.45', '252.50']"
2018-01-07T22:53:31,Well  Mr. Petrone sure gets it right. ,254.70,"['254.70', '253.20', '251.00', '249.45', '252.50']"
2018-01-07T22:50:35,Same  even at our age they’re still like that but  maybe,254.70,"['254.70', '253.20', '251.00', '249.45', '252.50']"
2018-01-07T22:46:53,Hate those kinds of girls. They need hugs. ,254.70,"['254.70', '253.20', '251.00', '249.45', '252.50']"
2018-01-07T22:31:12,Mike Petrone Piano at Brother's Lounge #117thDetroit  January 7  2018 at 05:30PM: ,254.70,"['254.70', '253.20', '251.00', '249.45', '252.50']"
2018-01-07T22:30:54,I was gonna ask u go get bloodys with me but it’s too cold for life rn,254.70,"['254.70', '253.20', '251.00', '249.45', '252.50']"
2018-01-07T22:18:00,I really wish that girls could just be nice and get along with eachother instead of being bitchy and rude towards eachother for no reason esp. when you don’t know them,254.70,"['254.70', '253.20', '251.00', '249.45', '252.50']"
2018-01-07T22:12:30,Really?? I’ll apply right now thank u so much!!,254.70,"['254.70', '253.20', '251.00', '249.45', '252.50']"
2018-01-07T21:54:05,Apply for moss rehab thats where my mom works and they always hire!,254.70,"['254.70', '253.20', '251.00', '249.45', '252.50']"
2018-01-07T21:50:55,@PIC_Colin @PIC_Petrone @Parmsisreal @ThomesHomie @LandPHIL54 #8 pick the goat,254.70,"['254.70', '253.20', '251.00', '249.45', '252.50']"
2018-01-07T21:11:19,The one on the right. Brightest color see logo,254.70,"['254.70', '253.20', '251.00', '249.45', '252.50']"
2018-01-07T19:45:54,Left.,254.70,"['254.70', '253.20', '251.00', '249.45', '252.50']"
2018-01-07T19:34:58,Far right,254.70,"['254.70', '253.20', '251.00', '249.45', '252.50']"
2018-01-07T18:32:48,Just applied to 8 different hospitals if one of them doesn’t hire me I may just lose my sanity,254.70,"['254.70', '253.20', '251.00', '249.45', '252.50']"
2018-01-07T18:26:00,Red brim. Thats a snazzy lookin hat.,254.70,"['254.70', '253.20', '251.00', '249.45', '252.50']"
2018-01-07T18:07:55,Need help... which hat should I wear to the game tonight!?pic.twitter.com/Vc3Cimisqa,254.70,"['254.70', '253.20', '251.00', '249.45', '252.50']"
2018-01-07T18:06:21,Can’t believe I’ve had my little Albus Dumbledog for a year already!!  #AdoptDontShop,254.70,"['254.70', '253.20', '251.00', '249.45', '252.50']"
2018-01-07T17:58:28,Why American Kids (and adults) Need Baseball – Nicholas Petrone – Medium #SmartNews,254.70,"['254.70', '253.20', '251.00', '249.45', '252.50']"
2018-01-07T17:57:00,Best Discount Quadcopter Battle Drone - Smartphone Remote Control Flying with Multiplayer Fighting Mode  Petrone... ,254.70,"['254.70', '253.20', '251.00', '249.45', '252.50']"
2018-01-07T17:36:53,#NowPlaying on @PressureZone: Raphael  Matt Petrone  Yan Kings - Don't Lie (Original Mix) #OnAirNow #EDM,254.70,"['254.70', '253.20', '251.00', '249.45', '252.50']"
2018-01-07T17:30:55,def just impulse-bought a scam purse never treating myself again,254.70,"['254.70', '253.20', '251.00', '249.45', '252.50']"
2018-01-07T17:06:09,Ryan Petrone talks about his road from Palisades Minor League Wiffle to the Palisades WBL on the Wiffle Statement... ,254.70,"['254.70', '253.20', '251.00', '249.45', '252.50']"
2018-01-07T16:57:17,Yes yes plz ,254.70,"['254.70', '253.20', '251.00', '249.45', '252.50']"
2018-01-07T16:52:30,Maggie’s date soon ¿,254.70,"['254.70', '253.20', '251.00', '249.45', '252.50']"
2018-01-07T16:26:18,Needed to start my new job like yesterday,254.70,"['254.70', '253.20', '251.00', '249.45', '252.50']"
2018-01-07T13:54:28,one person followed me // automatically checked by,254.70,"['254.70', '253.20', '251.00', '249.45', '252.50']"
2018-01-07T13:34:09,In the 2008 NFL draft the @Browns didn't have a selection until the 4th round  but still manage to pass on Josh Sitton in favor of LB Beau Bell and TE Martin Rucker #Browns,254.70,"['254.70', '253.20', '251.00', '249.45', '252.50']"
2018-01-07T13:27:47,@CLE_Passed_On thoughts,254.70,"['254.70', '253.20', '251.00', '249.45', '252.50']"
2018-01-07T13:13:56,go away petrone,254.70,"['254.70', '253.20', '251.00', '249.45', '252.50']"
2018-01-07T09:21:10,i mean that will have to go through petrone,254.70,"['254.70', '253.20', '251.00', '249.45', '252.50']"
2018-01-07T06:27:37,petrone I know you hate me but could I also get one,254.70,"['254.70', '253.20', '251.00', '249.45', '252.50']"
2018-01-07T02:42:27,Please RT if you like!! #Poker [VIDEO] Petrone vs. Isildur1: la batalla con cartas a la vista ,254.70,"['254.70', '253.20', '251.00', '249.45', '252.50']"
2018-01-07T02:37:09,Im officially an obsessive dog mom  #sorrynotsorry,254.70,"['254.70', '253.20', '251.00', '249.45', '252.50']"
2018-01-07T00:57:00,you know your a dog mom  when your dog poops outside for the first time in the freezing cold & you never been so proud,254.70,"['254.70', '253.20', '251.00', '249.45', '252.50']"
2018-01-07T00:54:19,It’s okay to hate them both equally. I do.,254.70,"['254.70', '253.20', '251.00', '249.45', '252.50']"
2018-01-07T00:48:13,Mariota just threw he block of the century #TitanUp,254.70,"['254.70', '253.20', '251.00', '249.45', '252.50']"
2018-01-07T00:40:18,In the immortal words of @FunnyMaine  RUN DA BAWL!!!!!! #TitanUp,254.70,"['254.70', '253.20', '251.00', '249.45', '252.50']"
2018-01-07T00:36:21,I need you defense,254.70,"['254.70', '253.20', '251.00', '249.45', '252.50']"
2018-01-07T00:20:40,Thanks guy....we’ve come a long way  PS I honestly can’t make up my mind who I hate more at this moment  the chiefs or titans...,254.70,"['254.70', '253.20', '251.00', '249.45', '252.50']"
2018-01-07T00:16:06,You’re a good follow  brother,254.70,"['254.70', '253.20', '251.00', '249.45', '252.50']"
2018-01-07T00:10:12,Don’t count us out #TitanUp,254.70,"['254.70', '253.20', '251.00', '249.45', '252.50']"
2018-01-07T00:02:16,Mmm whatcha say just came on in this Uber,254.70,"['254.70', '253.20', '251.00', '249.45', '252.50']"
2018-01-07T00:01:10,Chiefs go home,254.70,"['254.70', '253.20', '251.00', '249.45', '252.50']"
2018-01-30T23:18:06,Yea we was too on ,257.90,"['257.90', '254.75', '252.10', '243.30', '247.65']"
2018-01-30T22:32:34,Because we were both turnt ,257.90,"['257.90', '254.75', '252.10', '243.30', '247.65']"
2018-01-30T22:31:28,Definitely was! Why am i the only one smiling ,257.90,"['257.90', '254.75', '252.10', '243.30', '247.65']"
2018-01-30T21:47:05,I know. I want him cut from the 90 to make room for these 2,257.90,"['257.90', '254.75', '252.10', '243.30', '247.65']"
2018-01-30T21:33:14,Pic is drawn  that night was definitely LIT  good times,257.90,"['257.90', '254.75', '252.10', '243.30', '247.65']"
2018-01-30T21:09:17,Ugh i pray this works,257.90,"['257.90', '254.75', '252.10', '243.30', '247.65']"
2018-01-30T21:08:44,Yasss hoe,257.90,"['257.90', '254.75', '252.10', '243.30', '247.65']"
2018-01-30T20:55:14,He was cut from the 53 man roster  he still has a future reserve deal. Devante Harris is a part of the 90 man roster,257.90,"['257.90', '254.75', '252.10', '243.30', '247.65']"
2018-01-30T20:50:44,if the Eagles win the superbowl and have  a parade  i widh i had the patience to actually go to it but i cannot deal with that,257.90,"['257.90', '254.75', '252.10', '243.30', '247.65']"
2018-01-30T20:45:20,Check out this book - 'The Menacing House' by K.G. Petrone free #TeaserTuesday sample,257.90,"['257.90', '254.75', '252.10', '243.30', '247.65']"
2018-01-30T20:41:22,Check out this book - 'Cycles of Time - Revenge is Mine' by K.G. Petrone ,257.90,"['257.90', '254.75', '252.10', '243.30', '247.65']"
2018-01-30T19:48:57,You are a dentist and a piece of shit.,257.90,"['257.90', '254.75', '252.10', '243.30', '247.65']"
2018-01-30T18:58:09,He’s already cut,257.90,"['257.90', '254.75', '252.10', '243.30', '247.65']"
2018-01-30T18:37:26,"What happens when you're ""sacked"" at RJK?",257.90,"['257.90', '254.75', '252.10', '243.30', '247.65']"
2018-01-30T18:27:42,made my dog an instagram  what has my life become,257.90,"['257.90', '254.75', '252.10', '243.30', '247.65']"
2018-01-30T18:09:12,Cycles of Time - Revenge is Mine by K.G. Petrone ,257.90,"['257.90', '254.75', '252.10', '243.30', '247.65']"
2018-01-30T18:02:17,Thank you ,257.90,"['257.90', '254.75', '252.10', '243.30', '247.65']"
2018-01-30T17:11:49,Really gonna need a beer after this clinical Jesus Christ,257.90,"['257.90', '254.75', '252.10', '243.30', '247.65']"
2018-01-30T16:54:32,Oh ya,257.90,"['257.90', '254.75', '252.10', '243.30', '247.65']"
2018-01-30T16:36:36,I just remembered pulling over on the bridge so I could throw up ,257.90,"['257.90', '254.75', '252.10', '243.30', '247.65']"
2018-01-30T16:32:59,Definitely waspic.twitter.com/z4Vn2KOVz9,257.90,"['257.90', '254.75', '252.10', '243.30', '247.65']"
2018-01-30T16:28:31,That night was LIT ,257.90,"['257.90', '254.75', '252.10', '243.30', '247.65']"
2018-01-30T16:26:30,this picture popping up on my timehop from 3 years ago brought back memories of how fun this night was  @jaebrenemedia @__BREEZ__pic.twitter.com/bFUS2rBYhl,257.90,"['257.90', '254.75', '252.10', '243.30', '247.65']"
2018-01-30T15:04:33,WATCH as @chfdibari of @thecookerydf and our EIC @JuliaSexton take Rob Petrone of @RestaurantLHV cave dining. #thefutureisprimitive,257.90,"['257.90', '254.75', '252.10', '243.30', '247.65']"
2018-01-30T14:39:24,Best Discount Quadcopter Battle Drone - Smartphone Remote Control Flying with Multiplayer Fighting Mode  Petrone... ,257.90,"['257.90', '254.75', '252.10', '243.30', '247.65']"
2018-01-30T14:01:55,Index tumbles 80 pts   though Petronet gains 3% in todays session. :),257.90,"['257.90', '254.75', '252.10', '243.30', '247.65']"
2018-01-30T14:00:25,Find out what item of clothing Paolo  from Paolo Petrone  can't live with out  their favourite British designer and more.. ,257.90,"['257.90', '254.75', '252.10', '243.30', '247.65']"
2018-01-30T12:50:09,I've just posted a new blog: Petronet LNG Ltd. ,257.90,"['257.90', '254.75', '252.10', '243.30', '247.65']"
2018-01-30T12:48:23,Petronet trend reversal,257.90,"['257.90', '254.75', '252.10', '243.30', '247.65']"
2018-01-30T12:20:35,PARIS IN THE RAIN,257.90,"['257.90', '254.75', '252.10', '243.30', '247.65']"
2018-01-30T10:39:23,#S.S.Tips-#Performance-30th Jan 2018 7.BPCL 480 CE (Profit Rs.3150/lot) 8.PETRONET 250 CE Delivery (Profit Rs.9600/lot) #Any Query/Help Call at - 09990248471 ,257.90,"['257.90', '254.75', '252.10', '243.30', '247.65']"
2018-01-30T10:16:54,Thanks  Angela Cipriano Petrone  for your excellent review on Facebook @Birdeye_,257.90,"['257.90', '254.75', '252.10', '243.30', '247.65']"
2018-01-30T10:02:51,#MidcapGainers - RComm Up 10.85%; HPCL Up 4.8%; IOC Up 4.19%; Petronet Up 2.93; MRF Up 1.87%; Biocon Up 1.84% ,257.90,"['257.90', '254.75', '252.10', '243.30', '247.65']"
2018-01-30T09:47:05,6.BANKNIFTY (Profit Rs.8800/2lot) 7.BPCL 480 CE (Profit Rs.3150/lot) 8.PETRONET 250 CE Delivery (Profit Rs.9600/lot) ,257.90,"['257.90', '254.75', '252.10', '243.30', '247.65']"
2018-01-30T09:03:41,Oil Marketing companies like IOC   HINDPETRO   BPCL and also Petronet(Gas) seeing buying interest,257.90,"['257.90', '254.75', '252.10', '243.30', '247.65']"
2018-01-30T08:56:06,Yes  noticed. Petronet is also looking good.,257.90,"['257.90', '254.75', '252.10', '243.30', '247.65']"
2018-01-30T06:09:28,If you consider selling duplicate organs on the Black Market  I agree.,257.90,"['257.90', '254.75', '252.10', '243.30', '247.65']"
2018-01-30T06:06:51,Best Discount Quadcopter Battle Drone - Smartphone Remote Control Flying with Multiplayer Fighting Mode  Petrone... ,257.90,"['257.90', '254.75', '252.10', '243.30', '247.65']"
2018-01-30T05:16:50,tell that nigga to get over it. you and petrone are,257.90,"['257.90', '254.75', '252.10', '243.30', '247.65']"
2018-01-30T05:12:01,i’m alright. i’d be doing better if you unblocked petrone,257.90,"['257.90', '254.75', '252.10', '243.30', '247.65']"
2018-01-30T04:50:33,PETRONET# BUY 254.75 T: - / - / - 2018.01.30 10:20 Test Auto-Tweets.Chk ,257.90,"['257.90', '254.75', '252.10', '243.30', '247.65']"
2018-01-30T04:49:28,"i heard from petrone that you’re ""a black nigger  like an actual dark nigger” is this true? @altTuck",257.90,"['257.90', '254.75', '252.10', '243.30', '247.65']"
2018-01-30T04:45:22,ON YOUR MIND - Danny Petrone (2018 Promo Mix: ,257.90,"['257.90', '254.75', '252.10', '243.30', '247.65']"
2018-01-30T04:40:46,Anecdotally  my daughter pretty consistently referred to soda as beer (dark-colored beverage she isn't allowed to drink) until around the time she got to try soda.,257.90,"['257.90', '254.75', '252.10', '243.30', '247.65']"
2018-01-30T04:30:00,#PETRONET - buy at current level - ,257.90,"['257.90', '254.75', '252.10', '243.30', '247.65']"
2018-01-30T04:14:47,buy at current level $PETRONET ,257.90,"['257.90', '254.75', '252.10', '243.30', '247.65']"
2018-01-30T03:16:11,Petrone a bitch,257.90,"['257.90', '254.75', '252.10', '243.30', '247.65']"
2018-01-30T01:54:22,Hmm. . . It’s almost as if it *doesn’t* make sense to prioritize parking over badly needed new housing units in new builds ,257.90,"['257.90', '254.75', '252.10', '243.30', '247.65']"
2018-01-30T01:25:23,@Lavarbigballer  knows...         BBB,257.90,"['257.90', '254.75', '252.10', '243.30', '247.65']"
2018-01-30T00:26:05,#Indian #stocks: Petronet : #Acquisition  Concluded dubious sales profits in Jan 2018. ,257.90,"['257.90', '254.75', '252.10', '243.30', '247.65']"
2018-01-25T23:43:17,I liked a @YouTube video ,244.00,"['244.00', '250.50', '257.90', '254.75', '252.10']"
2018-01-25T23:38:08,I liked a @YouTube video ,244.00,"['244.00', '250.50', '257.90', '254.75', '252.10']"
2018-01-25T23:36:15,I liked a @YouTube video ,244.00,"['244.00', '250.50', '257.90', '254.75', '252.10']"
2018-01-25T23:28:32,I liked a @YouTube video ,244.00,"['244.00', '250.50', '257.90', '254.75', '252.10']"
2018-01-25T23:22:37,I liked a @YouTube video ,244.00,"['244.00', '250.50', '257.90', '254.75', '252.10']"
2018-01-25T23:18:10,I liked a @YouTube video ,244.00,"['244.00', '250.50', '257.90', '254.75', '252.10']"
2018-01-25T23:17:24,I liked a @YouTube video ,244.00,"['244.00', '250.50', '257.90', '254.75', '252.10']"
2018-01-25T23:15:43,I liked a @YouTube video ,244.00,"['244.00', '250.50', '257.90', '254.75', '252.10']"
2018-01-25T23:15:31,I liked a @YouTube video ,244.00,"['244.00', '250.50', '257.90', '254.75', '252.10']"
2018-01-25T23:14:11,I liked a @YouTube video ,244.00,"['244.00', '250.50', '257.90', '254.75', '252.10']"
2018-01-25T23:13:16,You have to stand for the anthem in Canada...Also you can’t get into Canada if you have prior arrests...Besides that though...go for it... Ps the C in CFL stands for Canada,244.00,"['244.00', '250.50', '257.90', '254.75', '252.10']"
2018-01-25T23:11:18,I liked a @YouTube video ,244.00,"['244.00', '250.50', '257.90', '254.75', '252.10']"
2018-01-25T22:53:25,Twitter already race/Politic Baiting the XFL with Kaepernick talk  League starts in 2020  Yawn,244.00,"['244.00', '250.50', '257.90', '254.75', '252.10']"
2018-01-25T22:32:53,when should i upload vid with petrone,244.00,"['244.00', '250.50', '257.90', '254.75', '252.10']"
2018-01-25T22:00:49,I just got that book! Am going to read it soon,244.00,"['244.00', '250.50', '257.90', '254.75', '252.10']"
2018-01-25T21:05:01,Come support the Hoops for Hope basketball game  as the Bunn Bulldogs' staff takes on the Cedar Creek staff  February 22 @ 6pm. Tickets will be $5 at the gate. We will have food  raffles  prizes  and fun! All proceeds go to Relay for Life and cancer research. See you there!,244.00,"['244.00', '250.50', '257.90', '254.75', '252.10']"
2018-01-25T21:02:09,Fire and Fury says its true,244.00,"['244.00', '250.50', '257.90', '254.75', '252.10']"
2018-01-25T20:55:46,This is funnierpic.twitter.com/wOU4W5HfZG,244.00,"['244.00', '250.50', '257.90', '254.75', '252.10']"
2018-01-25T19:24:51,Sweeeeeeep,244.00,"['244.00', '250.50', '257.90', '254.75', '252.10']"
2018-01-25T19:14:10,Omg  it’s cuter in person,244.00,"['244.00', '250.50', '257.90', '254.75', '252.10']"
2018-01-25T19:13:05,not as much of a scam as i thoughtpic.twitter.com/NOgKOMrgXo,244.00,"['244.00', '250.50', '257.90', '254.75', '252.10']"
2018-01-25T19:10:45,Definitely worth it. It’s a super important read  i think you’d like it. My boss (during my winter term) is moderating the panel discussion on it at Shaker Library on the 15th.,244.00,"['244.00', '250.50', '257.90', '254.75', '252.10']"
2018-01-25T18:55:50,It's on my to-read list. Sounds like it's worth the time if existentially difficult.,244.00,"['244.00', '250.50', '257.90', '254.75', '252.10']"
2018-01-25T18:50:26,Matthew Desmond’s “Evicted” is really an excellent book but  wow  it can take a lot out of me to read parts of it,244.00,"['244.00', '250.50', '257.90', '254.75', '252.10']"
2018-01-25T18:25:48,still can’t believe petrone cloned me,244.00,"['244.00', '250.50', '257.90', '254.75', '252.10']"
2018-01-25T18:08:39,petrone unblock him,244.00,"['244.00', '250.50', '257.90', '254.75', '252.10']"
2018-01-25T17:56:01,T minus 3 hours til I land in Florida ,244.00,"['244.00', '250.50', '257.90', '254.75', '252.10']"
