2018-03-26T18:35:00,We'd love to introduce you to Vanessa Petrone  one of our account managers! ,225.90,"['225.90', '226.75', '230.95', '230.85', '232.00']"
2018-03-26T17:12:33,1pm on a Monday and I could really go for a marg or two,225.90,"['225.90', '226.75', '230.95', '230.85', '232.00']"
2018-03-26T17:08:26,Y don’t petrone do it himself he better than most editors out ngl ..,225.90,"['225.90', '226.75', '230.95', '230.85', '232.00']"
2018-03-26T17:05:20,Let me pass out with a bottle on Petrone...,225.90,"['225.90', '226.75', '230.95', '230.85', '232.00']"
2018-03-26T13:41:44,We are late in posting but we wanted to share that we welcomed Logan Thomas Petrone to this… ,225.90,"['225.90', '226.75', '230.95', '230.85', '232.00']"
2018-03-26T07:52:15,way cancel Petronet LNG Sell high made 240.80 cmp 224.30 near target......... ,225.90,"['225.90', '226.75', '230.95', '230.85', '232.00']"
2018-03-26T06:36:04,Market Now: Oil stocks under pressure; GAIL  HPCL crack over 3%  #BPCL #HINDPETRO #IOC #IGL #PETRONET #RELIANCE #NaturalGas #Stocks #Nifty,225.90,"['225.90', '226.75', '230.95', '230.85', '232.00']"
2018-03-26T05:38:04,"""Petrone has combined outside-of-the-box thinking with flexibility to achieve a highly customized ecommerce site. We are excited and proud of our newest addition of services to our ever-growing family of clients "" Victor Petrone  Petrone’s CEO.",225.90,"['225.90', '226.75', '230.95', '230.85', '232.00']"
2018-03-26T05:38:01,-Social and viral marketing capabilities designed to encourage repeat orders  such as free event reminders  Petrone Points Reward Program  personalized greeting and responses and Gift cards,225.90,"['225.90', '226.75', '230.95', '230.85', '232.00']"
2018-03-26T05:38:00,The storefront features a plethora of features and options that were customized to the Petrone business model. Special features of the new site-developed in part using innovative technology-include:,225.90,"['225.90', '226.75', '230.95', '230.85', '232.00']"
2018-03-26T05:37:59,"Victor Petrone CEO  said  ""We feel that we achieved a robust ecommerce platform that is tailored to our needs and allows us to communicate and engage with customers in unique and interactive ways.",225.90,"['225.90', '226.75', '230.95', '230.85', '232.00']"
2018-03-26T05:37:57,Weston  Florida  Nov. 20  2017 (GLOBE NEWSWIRE) -- Petrone Worldwide  Inc. (PFWI)  operates within the hospitality industry with global operations capabilities  today announced the launch of a dynamic new ecommerce website  under ,225.90,"['225.90', '226.75', '230.95', '230.85', '232.00']"
2018-03-26T05:37:56,Petrone Worldwide  Inc. Launches Highly Customized  Feature-Rich  and Immersive Ecommerce Site for Retail Sales $PFWI,225.90,"['225.90', '226.75', '230.95', '230.85', '232.00']"
2018-03-26T05:35:13,With all the Port delays  planning for safety stock has become all that much more of a key component to reducing fulfillment costs. Supply Chain operation efficiency of Petrone will bring optimum results with minimum budget.,225.90,"['225.90', '226.75', '230.95', '230.85', '232.00']"
2018-03-26T05:35:12,With the addition of these capabilities Petrone Worldwide is able to drive value for its customers through lower costs and faster time-to market.,225.90,"['225.90', '226.75', '230.95', '230.85', '232.00']"
2018-03-26T05:35:11,"We have grown to a point that in order to expand and support the growing needs of our customers  we must partner with an organization such as Petrone Worldwide. We are all very excited and look forward to working with the team.""",225.90,"['225.90', '226.75', '230.95', '230.85', '232.00']"
2018-03-26T05:35:10,"Petrone is the ideal organization based on its ability to augment our current capabilities for over eighteen months and its significant market strength in the logistics  marketing and warehousing segment "" said this strategic alliance with Petrone Worldwide",225.90,"['225.90', '226.75', '230.95', '230.85', '232.00']"
2018-03-26T05:35:07,Victor Petrone further states  “The service includes Direct Store delivery of Dewans products to retail stores  thereby bypassing a retailer’s distribution center to increase inventory turns and reduce margins for Dewan.”,225.90,"['225.90', '226.75', '230.95', '230.85', '232.00']"
2018-03-26T05:35:07,along with the potential to serve over one billion potential new customers for Dewan” said Victor Petrone  CEO of PFWI.,225.90,"['225.90', '226.75', '230.95', '230.85', '232.00']"
2018-03-26T05:35:04,Weston  FL.   Oct. 13  2017 (GLOBE NEWSWIRE) -- Petrone Worldwide  Inc. (OTC: PFWI)  has over 20 years of dedicated sales  marketing and product development expertise within the hospitality industry announces today that it has expanded its business with Dewan & Sons,225.90,"['225.90', '226.75', '230.95', '230.85', '232.00']"
2018-03-26T05:35:04,Petrone Worldwide Enters into Definitive Agreement with Dewan Sons Forming an International Alliance $PFWI,225.90,"['225.90', '226.75', '230.95', '230.85', '232.00']"
2018-03-26T05:32:45,"We look forward to securing future financing as we seek to add better value for Petrone Worldwide and its shareholders.""",225.90,"['225.90', '226.75', '230.95', '230.85', '232.00']"
2018-03-26T05:32:43,"Victor Petrone  CEO of Petrone Worldwide  Inc.  commented  ""This benchmark today is beneficial for the shareholders and The Company.",225.90,"['225.90', '226.75', '230.95', '230.85', '232.00']"
2018-03-26T05:32:42,Weston  Florida   Sept. 14  2017 (GLOBE NEWSWIRE) -- Petrone Worldwide  Inc. (OTCQB: PFWI)  today announces that the company has secured $100 000 in financing that carries a low interest rate along with no prepayment or penalty charges and it has simultaneously retired $100 000,225.90,"['225.90', '226.75', '230.95', '230.85', '232.00']"
2018-03-26T05:32:41,Petrone Worldwide  Inc. Obtains Financing and Retires Toxic Debt $PFWI,225.90,"['225.90', '226.75', '230.95', '230.85', '232.00']"
2018-03-26T05:31:48,Over the long-term  these larger  multi-year deals will provide us with a more stable foundation to accelerate growth and drive increased visibility into future revenues ” Petrone concluded.,225.90,"['225.90', '226.75', '230.95', '230.85', '232.00']"
2018-03-26T05:31:47,“Petrone Worldwide’s relationships and know-how to properly market a data-driven offering will guide our repositioning and the focus on large dollar transactions that are syndicated over multiple years with recurring revenues.,225.90,"['225.90', '226.75', '230.95', '230.85', '232.00']"
2018-03-26T05:31:46,Victor Petrone  Petrone Worldwide’s Chief Executive Officer commented  “My clear mission as CEO is to drive long-term growth and unlock sustainable value for all our shareholders.,225.90,"['225.90', '226.75', '230.95', '230.85', '232.00']"
2018-03-26T05:31:42,Petrone Worldwide  Inc. (OTCQB: PFWI)  leader in the hospitality industry with global operations capabilities.  announced today its financial results for the second quarter and six months ended June 30  2017.,225.90,"['225.90', '226.75', '230.95', '230.85', '232.00']"
2018-03-26T05:31:41,Petrone Worldwide  Inc. Reports 98% Increase in Revenue for Second Quarter $PFWI,225.90,"['225.90', '226.75', '230.95', '230.85', '232.00']"
2018-03-26T05:29:34,Petrone Worldwide  Inc. will continue to update both the public and shareholders on a regular basis by way of press releases  financial statements and other SEC disclosures.,225.90,"['225.90', '226.75', '230.95', '230.85', '232.00']"
2018-03-26T05:29:34,"We are thrilled to welcome our newest addition of services to our ever-growing family of clients "" Victor Petrone  Petrone’s CEO.",225.90,"['225.90', '226.75', '230.95', '230.85', '232.00']"
2018-03-26T05:29:33,"""The new ",225.90,"['225.90', '226.75', '230.95', '230.85', '232.00']"
2018-03-26T05:29:29,The storefront features a plethora of features and options that were customized to the Petrone business model. Special features of the new site-developed in part using cutting-edge technology-include:,225.90,"['225.90', '226.75', '230.95', '230.85', '232.00']"
2018-03-26T05:29:28,"Victor Petrone CEO  said  ""We needed a complete and robust ecommerce platform that could be fully tailored to our needs and allow us to communicate and engage with customers in unique and interactive ways.",225.90,"['225.90', '226.75', '230.95', '230.85', '232.00']"
2018-03-26T05:29:27,Petrone seeks to achieve a fully customized ecommerce solution within budget and in approximately 90 days. With the launch of this site  as a current vendor the company is poised to assist its retailers compete with the major online consumer demand.,225.90,"['225.90', '226.75', '230.95', '230.85', '232.00']"
2018-03-26T05:29:26,Weston  Florida – August 21  2017. Petrone Worldwide  Inc. (OTCQB: PFWI)  is a leader in the hospitality industry with global operations capabilities  today announced the launch of a dynamic new ecommerce website  under ,225.90,"['225.90', '226.75', '230.95', '230.85', '232.00']"
2018-03-26T05:29:25,Petrone Worldwide  Inc. to Launch Highly Customized  Feature-Rich  and Immersive Ecommerce Site for Retail Sales  $PFWI,225.90,"['225.90', '226.75', '230.95', '230.85', '232.00']"
2018-03-26T05:27:14,Petrone Worldwide  Inc. will continue to update both the public and shareholders on a regular basis by way of press releases  financial statements and other SEC disclosures.,225.90,"['225.90', '226.75', '230.95', '230.85', '232.00']"
2018-03-26T05:27:12,"""We're taking Bulk Water  Packaged & Bottled Water solutions to the 1.1 Billion people that lack clean  potable water"" said Victor Petrone  chief executive officer.",225.90,"['225.90', '226.75', '230.95', '230.85', '232.00']"
2018-03-26T05:27:11,Petrone will globally supply potable water through its logistics platform under exclusivity of negotiated long-term ‘Water Purchase Agreements’ from two governmental renewable fresh water sources.,225.90,"['225.90', '226.75', '230.95', '230.85', '232.00']"
2018-03-26T05:27:10,Weston  Florida (Uptick Newswire - August 14  2017) - Petrone Worldwide  Inc. (OTCQB: PFWI)  Bulk water supplies are used for both everyday and emergency situations and include applications related to potable and non-potable water delivery systems and subsystems,225.90,"['225.90', '226.75', '230.95', '230.85', '232.00']"
2018-03-26T05:27:10,Petrone Worldwide  Inc. Signs Letter of Intent with Bio-Clean International  Inc. to Distribute Potable Bulk Water Globally Due to the Demand from Water Stressed Regions $PFWI,225.90,"['225.90', '226.75', '230.95', '230.85', '232.00']"
2018-03-26T05:26:21,Petrone Worldwide  Inc. will continue to update both the public and shareholders on a regular basis by way of press releases  financial statements and other SEC disclosures.,225.90,"['225.90', '226.75', '230.95', '230.85', '232.00']"
2018-03-26T05:26:20,"""We're taking foodservice product offerings and marketing to the next level by targeting our new offerings to specific trends and sales points of our customers "" said Victor Petrone  chief executive officer.",225.90,"['225.90', '226.75', '230.95', '230.85', '232.00']"
2018-03-26T05:26:19,Petrone also will showcase to hospitality and foodservice buyers  restaurateurs and hoteliers to explore Petrone's portfolio door to door.,225.90,"['225.90', '226.75', '230.95', '230.85', '232.00']"
2018-03-26T05:26:18,Petrone's commitment to grow sales through innovative  trend-right and problem-solving new products will meet consumer demand.,225.90,"['225.90', '226.75', '230.95', '230.85', '232.00']"
2018-03-26T05:26:17,WESTON  FL--(Marketwired - Jun 20  2017) - Petrone Worldwide  Inc. (OTCQB: PFWI) is a leader in the hospitality industry with global operations capabilities  with more than 150 new products debuting and available in inventory.,225.90,"['225.90', '226.75', '230.95', '230.85', '232.00']"
2018-03-26T05:26:17,Petrone Worldwide's Strategic Partnerships and Prior Capital Investments Position Petrone to Dramatically Increase Revenues $PFWI,225.90,"['225.90', '226.75', '230.95', '230.85', '232.00']"
2018-03-26T05:23:26,Coward you almost got me jacked petrone,225.90,"['225.90', '226.75', '230.95', '230.85', '232.00']"
2018-03-26T05:17:21,Petrone Worldwide  Inc. will continue to update both the public and shareholders on a regular basis by way of press releases  financial statements and other SEC disclosures.,225.90,"['225.90', '226.75', '230.95', '230.85', '232.00']"
2018-03-26T05:17:19,Mr. Petrone believes that the potential for restauranteurs  hoteliers and design firms to easily access the products of PFWI is key; therefore  inventory in the market place is key.,225.90,"['225.90', '226.75', '230.95', '230.85', '232.00']"
2018-03-26T05:17:18,PFWI's founder  Victor Petrone  has spent over 20 years building a significant global network of institutional hospitality industry buyers (hotels  resorts and restaurants). PFWI is the exclusive importer and distributor for renowned brands.,225.90,"['225.90', '226.75', '230.95', '230.85', '232.00']"
2018-03-26T05:17:17,WESTON  FL--(Marketwired - Jun 14  2017) - Petrone Worldwide  Inc. (OTCQB: PFWI)  a leader in the hospitality industry with global operations capabilities  announces its official purchase of inventory to meet the increased demand in the European and India Marketplace.,225.90,"['225.90', '226.75', '230.95', '230.85', '232.00']"
2018-03-26T05:17:17,Petrone Worldwide  Inc. (OTCQB: PFWI) Purchases Inventory to Satisfy the Increased Demand in the European and India Marketplace $PFWI,225.90,"['225.90', '226.75', '230.95', '230.85', '232.00']"
2018-03-26T05:16:04,Petrone Worldwide  Inc. will continue to update both the public and shareholders on a regular basis by way of press releases  financial statements and other SEC disclosures.,225.90,"['225.90', '226.75', '230.95', '230.85', '232.00']"
2018-03-26T05:16:04,"We are all very excited and look forward to working with the team. With the addition of these capabilities Petrone Worldwide is able to drive value for its customers through lower costs and faster time-to market "" said Surender Gandhi  President of Dewan & Sons.",225.90,"['225.90', '226.75', '230.95', '230.85', '232.00']"
2018-03-26T05:16:03,Dewan has a large array of high profile customers that we currently service. We have grown to a point that in order to expand and support the growing needs of our customers  we must partner with an organization such as Petrone.,225.90,"['225.90', '226.75', '230.95', '230.85', '232.00']"
2018-03-26T05:16:03,now with direct sales and service. This strategic alliance with Petrone creates increased real-time communication with our purchasing agents and creates a new service which is preferable  allowing reduced Minimum Order inventory.,225.90,"['225.90', '226.75', '230.95', '230.85', '232.00']"
2018-03-26T05:16:02,"""We evaluated many companies to determine the functionality that would best fit our organization. Petrone is the ideal organization based on its ability to augment our current capabilities and its significant market strength in the logistics and warehousing segment ",225.90,"['225.90', '226.75', '230.95', '230.85', '232.00']"
2018-03-26T05:16:02,Petrone will be serving the following Dewan clients in North America: Wal Mart  Sam's Club  TJ Maxx  Home Goods  and Marshall's.,225.90,"['225.90', '226.75', '230.95', '230.85', '232.00']"
2018-03-26T05:16:01,"Victor Petrone  CEO further says  ""The service includes Direct Store delivery of Dewan's products to retail stores  thereby bypassing a retailer's distribution center to increase inventory turns and reduce margins for Dewan.""",225.90,"['225.90', '226.75', '230.95', '230.85', '232.00']"
2018-03-26T05:16:01,"with JIT and lean inventory management will be a significant cost savings for Dewan and will create a projected $5 000 000+ in new revenue for PFWI adding dramatic value to the company and its shareholders "" said Victor Petrone  CEO and founder of PFWI.",225.90,"['225.90', '226.75', '230.95', '230.85', '232.00']"
2018-03-26T05:16:00,a leading Houseware articles export house with an established presence in the United States has appointed Petrone as the North American exclusive agent  with this strategic alliance to undertake direct sales and JIT distribution to all Dewan customers in North America.,225.90,"['225.90', '226.75', '230.95', '230.85', '232.00']"
2018-03-26T05:15:59,WESTON  FL--(Marketwired - Mar 23  2017) - Petrone Worldwide  Inc. (OTCQB: PFWI)  a leader in the hospitality industry with global operations capabilities  announces today the signing of a strategic alliance with Dewan & Sons. Dewan & Sons India ,225.90,"['225.90', '226.75', '230.95', '230.85', '232.00']"
2018-03-26T05:15:59,Petrone Worldwide Announces the Signing of a Strategic Agreement to Undertake Direct Sales and Distribution to all Dewan & Sons Customers in North America $PFWI,225.90,"['225.90', '226.75', '230.95', '230.85', '232.00']"
2018-03-26T05:14:26,Petrone Worldwide  Inc. will continue to update both the public and shareholders as the Company formalizes their deal with Twisted Lab and begins international distribution of their products.,225.90,"['225.90', '226.75', '230.95', '230.85', '232.00']"
2018-03-26T05:14:26,"Petrone Worldwide is going to provide Twisted Lab the logistics and distribution network it needs to break into several new completely untapped markets in Europe. Both companies will see dramatic increases in both activity and brand awareness due to this partnership.""",225.90,"['225.90', '226.75', '230.95', '230.85', '232.00']"
2018-03-26T05:14:25,"Victor Petrone  CEO and founder of PFWI  says  ""We are very pleased to be in business with a company such as Twisted Lab as they truly have revolutionized the cannabis industry with their innovative product line.",225.90,"['225.90', '226.75', '230.95', '230.85', '232.00']"
2018-03-26T05:14:24,In addition  PFWI will facilitate the building of a premier international sales and marketing distribution network throughout the sovereign states of Europe that will be mutually beneficial for both Petrone Worldwide and Twisted Lab.,225.90,"['225.90', '226.75', '230.95', '230.85', '232.00']"
2018-03-26T05:14:23,WESTON  FL--(Marketwired - Feb 21  2017) -  Petrone Worldwide  Inc. (OTCQB: PFWI)  a leader in the hospitality industry with global operations capabilities  announces today,225.90,"['225.90', '226.75', '230.95', '230.85', '232.00']"
2018-03-26T05:14:23,Petrone Worldwide  Inc. Signs Letter of Intent with Twisted Lab  LLC to Distribute Cannabis Related Products Throughout Europe $PFWI,225.90,"['225.90', '226.75', '230.95', '230.85', '232.00']"
2018-03-26T05:13:26,Petrone Worldwide  Inc. will continue to update both the public and shareholders as the Company makes this exciting transition into the cannabis market.,225.90,"['225.90', '226.75', '230.95', '230.85', '232.00']"
2018-03-26T05:13:26,"This is merely a diversification of what Petrone Worldwide currently does and it will surely boost not only Company revenues  but also long-term shareholder value.""",225.90,"['225.90', '226.75', '230.95', '230.85', '232.00']"
2018-03-26T05:13:25,"Victor Petrone  CEO and founder of PFWI  says  ""Petrone Worldwide has been contemplating entering the cannabis market for several months and we feel that now is the time to make our move.",225.90,"['225.90', '226.75', '230.95', '230.85', '232.00']"
2018-03-26T05:13:24,WESTON  FL--(Marketwired - Feb 17  2017) - Petrone Worldwide  Inc. (OTCQB: PFWI)  a leader in the hospitality industry with global operations capabilities  announces today that the Company is in the process of entering the cannabis market in the very near future.,225.90,"['225.90', '226.75', '230.95', '230.85', '232.00']"
2018-03-26T05:13:23,Petrone Worldwide  Inc. is Finalizing Plans to Enter the Multi-Billion Dollar Cannabis Market $PFWI,225.90,"['225.90', '226.75', '230.95', '230.85', '232.00']"
2018-03-26T01:06:27,petrone tomorrow,225.90,"['225.90', '226.75', '230.95', '230.85', '232.00']"
2018-03-26T00:38:52,hey petrone ,225.90,"['225.90', '226.75', '230.95', '230.85', '232.00']"
2018-03-26T00:25:11,You know soliciting a prostitute is a crime right?,225.90,"['225.90', '226.75', '230.95', '230.85', '232.00']"
2018-04-09T23:46:29,It is...,239.25,"['239.25', '235.90', '235.70', '238.10', '236.00']"
2018-04-09T23:31:50,Yes but since I do not know all the different issues/problems this may cause since I am not the president and the people that are advising him. my answer could be different if I had more info.,239.25,"['239.25', '235.90', '235.70', '238.10', '236.00']"
2018-04-09T23:21:26,you float like a feather-in a beautiful world-and I wish I was special-you’re so fuc@in special… ,239.25,"['239.25', '235.90', '235.70', '238.10', '236.00']"
2018-04-09T23:13:15,So what? It’s at best a civil fine! You do not care about all the other shit mueller is doing? How he was appointed? The potential client/attorney privilege privacy challlenge by mueller?,239.25,"['239.25', '235.90', '235.70', '238.10', '236.00']"
2018-04-09T23:03:30,Has anyone started creating theresocial media accounts??,239.25,"['239.25', '235.90', '235.70', '238.10', '236.00']"
2018-04-09T23:01:07,You just upload the word doc to canvas!,239.25,"['239.25', '235.90', '235.70', '238.10', '236.00']"
2018-04-09T23:00:56,I just submitted mine too!!! I hope I did it right I followed the template on the lecture today!,239.25,"['239.25', '235.90', '235.70', '238.10', '236.00']"
2018-04-09T22:40:40,Why that is not full proof way of knowing the truth. It’s just pure speculation from sudo expert. Your being like the dems. It will start making up shit. Your time off did not help.,239.25,"['239.25', '235.90', '235.70', '238.10', '236.00']"
2018-04-09T22:34:16,3 people unfollowed me // automatically checked by,239.25,"['239.25', '235.90', '235.70', '238.10', '236.00']"
2018-04-09T22:21:57,My babies!  I have a busy week ahead.  So I thought it best to forgo going out for sunday and… ,239.25,"['239.25', '235.90', '235.70', '238.10', '236.00']"
2018-04-09T22:21:25,Never ever accept this one world BS!!! Our freedoms will be destroyed!,239.25,"['239.25', '235.90', '235.70', '238.10', '236.00']"
2018-04-09T22:20:25,They are trying to brain wash all of us. We must fight against this and never ever accept it!!!,239.25,"['239.25', '235.90', '235.70', '238.10', '236.00']"
2018-04-09T22:18:30,But they can raid the presidents private lawyer. THEY ARE HIDING SOMETHING FOR SURE AND WE THE PEOPLE MUST FIND OUT NOW AND NOT LATER!!!!,239.25,"['239.25', '235.90', '235.70', '238.10', '236.00']"
2018-04-09T22:18:22,Woot woot,239.25,"['239.25', '235.90', '235.70', '238.10', '236.00']"
2018-04-09T22:17:57,OHHHH YESSSSS!!!! I LOVE @jackblack  This is going to be so awesome!,239.25,"['239.25', '235.90', '235.70', '238.10', '236.00']"
2018-04-09T22:15:14,He should be immediately fired. This also should be a crime. But he is a rich billionaire it will do nothing unless he goes to prison. Us normal people would Be screwed and probably arrested.,239.25,"['239.25', '235.90', '235.70', '238.10', '236.00']"
2018-04-09T22:14:55,COOL!,239.25,"['239.25', '235.90', '235.70', '238.10', '236.00']"
2018-04-09T22:12:37,Totally disgusted by this BS!!! Mueller needs to be arrested he is out of control!,239.25,"['239.25', '235.90', '235.70', '238.10', '236.00']"
2018-04-09T21:53:09,Let’s go right after the test!! Or stay for a little for class than gooo,239.25,"['239.25', '235.90', '235.70', '238.10', '236.00']"
2018-04-09T21:52:26,Hotel California Dreaming,239.25,"['239.25', '235.90', '235.70', '238.10', '236.00']"
2018-04-09T21:50:41,@EOSmithSoftball picks up win against rocky hill 15-0 #eosoftball #ctsb,239.25,"['239.25', '235.90', '235.70', '238.10', '236.00']"
2018-04-09T21:36:59,@Mara_Petrone daily struggles  pic.twitter.com/okvLu9SnmC,239.25,"['239.25', '235.90', '235.70', '238.10', '236.00']"
2018-04-09T21:32:28,Michael Coh-leone will soon be going away for a long time..,239.25,"['239.25', '235.90', '235.70', '238.10', '236.00']"
2018-04-09T21:29:12,It's a great day when you wake up and see your book being sponsored by Barnes and Noble on Google. ,239.25,"['239.25', '235.90', '235.70', '238.10', '236.00']"
2018-04-09T20:36:29,Let’s get hibachi Wednesday,239.25,"['239.25', '235.90', '235.70', '238.10', '236.00']"
2018-04-09T20:26:08,he is not buying them he has our votes,239.25,"['239.25', '235.90', '235.70', '238.10', '236.00']"
2018-04-09T20:10:41,The long house hunt is finally over. Contact me now for a showing! #homesforsale ,239.25,"['239.25', '235.90', '235.70', '238.10', '236.00']"
2018-04-09T19:59:17,Do you incorporate nature into your home? #architecture #homedesign ,239.25,"['239.25', '235.90', '235.70', '238.10', '236.00']"
2018-04-09T19:52:15,Photography by Jean Louis Petrone #jeanlouispetronepic.twitter.com/kb9Iw351AH,239.25,"['239.25', '235.90', '235.70', '238.10', '236.00']"
2018-04-09T19:39:31,I love step up 2 but not as much as step up revolution,239.25,"['239.25', '235.90', '235.70', '238.10', '236.00']"
2018-04-09T19:36:53,You are the best Moose,239.25,"['239.25', '235.90', '235.70', '238.10', '236.00']"
2018-04-09T19:30:55,Life is the Krabby Patty  I’m the pizza.pic.twitter.com/gsp260GJva,239.25,"['239.25', '235.90', '235.70', '238.10', '236.00']"
2018-04-09T19:24:52,Been in Cali for a little over a week now and can't get over the drive-thru obsession here. Line at In-N-Out a dozen cars deep. Inside? Walk right up and order.,239.25,"['239.25', '235.90', '235.70', '238.10', '236.00']"
2018-04-09T19:16:27,that's how I teach it  tbh,239.25,"['239.25', '235.90', '235.70', '238.10', '236.00']"
2018-04-09T19:11:29,Someone please get food with me later.,239.25,"['239.25', '235.90', '235.70', '238.10', '236.00']"
